"office_id","office_name","state","city","street_address","zip_code","phone_number","office_rent"
1,"Dream Homes Metro Brooklyn","NY","Brooklyn","1672 Carl Locks","11350","840-388-5421","16788.78"
2,"Dream Homes Metro Queens","NY","Queens","04432 Roberts Ways Suite 195","10002","683-237-4184","16015.91"
3,"Dream Homes Harbor Newark","NJ","Newark","9483 Henderson Heights","07235","672-344-0107","12788.60"
4,"Dream Homes Garden Jersey City","NJ","Jersey City","875 Wendy Flat Apt. 637","07227","425-695-8351","13686.28"
5,"Dream Homes Gold Coast Stamford","CT","Stamford","349 David Fall","06921","470-051-4505","9049.25"
6,"Dream Homes North Star Greenwich","CT","Greenwich","2691 Williamson Mills Suite 246","06511","925-905-0725","11723.95"
